<?xml version="1.0" encoding="UTF-8"?>
<!--
Click nbfs://nbhost/SystemFileSystem/Templates/Licenses/license-default.txt to change this license
Click nbfs://nbhost/SystemFileSystem/Templates/XML/XMLDocument.xml to edit this template
-->



<edificio alquiler="verdadeiro" valor="410.50" xmlns:xsi="http://www.w3.org/2001/XMLSchema-instance"
          xsi:noNamespaceSchemaLocation="UD4_T5A_yagootero.xsd">
   <enderezo>
      <rua>Ponzano</rua>
      <numero>66</numero>
      <poboacion>Madrid</poboacion>
      <provincia>Madrid</provincia>
      <codigoPostal>28003</codigoPostal>
   </enderezo>
   <dataConstrucion mes="eneiro" ano="1989" />
   <material>formig√≥n</material>
</edificio>

